B1: Year | C1: Season | D1: Amount | E1: Comments
B2: 1976-77 | C2: Fall | D2: 2270 | E2: Tuition / Room & Board
C3: Spring | D3: 2325 | E3: Tuition / Room & Board
C4: Total | D4: =SUM(D2:D3) -> 4595
B6: 1977-78 | C6: Fall | D6: 2490 | E6: Tuition / Room & Board
C7: Spring | D7: 2490 | E7: Tuition / Room & Board
C8: Total | D8: =SUM(D6:D7) -> 4980
B10: 1978-79 | C10: Fall | D10: 1670.5 | E10: Tuition
C11: Spring | D11: 1629.5 | E11: Tuition
C12: Total | D12: =SUM(D10:D11) -> 3300
B14: 1979-80 | C14: Fall | D14: 1800 | E14: Tuition
C15: Spring | D15: 1825 | E15: Tuition
C16: Total | D16: =SUM(D14:D15) -> 3625
C18: Grand Total | D18: =+D4+D8+D12+D16 -> 16500